INPUT:text1	INPUT:text2	OUTPUT:result	CONFIDENCE:result	
игра где надо командовать отрядом	игра squad	yes	98.72%	
карбюратор без праймера работает на подсосе, нормально, без подсоса, идет вразнос.	карбюратор на пиле идет разнос?	yes	99.94%	
цена на новую газель фермер	погода в малой сердобе пензенской области на 10 дней	no	98.87%	
ресторан dr живаго	больница святого владимира в сокольниках	no	99.55%	
территория горка 5 иркутск	елизов павел анатольевич иркутск	no	55.06%	
remove postgresql ubuntu	psql role does not exist	no	94.85%	
как на мегафон отключить tv подписку	почему джифорс экспириенс не видит видеокарту nvidia	no	99.99%	
теории цивилизации учебник	цивилизация это	yes	99.96%	
евгений челтыгмашев хакасия биография	уборка моркови сроки в сибири	no	99.99%	
самый большой храм ростова на дону	церковь дмитрия донского	yes	99.99%	
16 января 1547	впр по истории вариант 72754	no	79.03%	
airport city	регистрация пребывающих в рф госуслуги когда заполнять	yes	77.15%	
задачи равномерное прямолинейное движение 9 класс с решением 10 вариант	погода в венгерово	no	99.99%	
каких элементов больше всего в клетке	Какой из перечисленных элементов не относится к макроэлементам    ￼кислород  ￼золото  ￼углерод  ￼азот	yes	98.20%	
диагональ меньшей боковой грани прямоугольного параллелепипеда равна большему ребру основания	в основании прямой призмы ромб диагонали призмы составляют с плоскостью основания углы 30 и 60	yes	90.30%	
дезинфицирующий препарат 369	дезинфицирующий препарат от грибков	yes	99.99%	
сэра меладзе слушать онлайн бесплатно	михаил шуфутинский скачать бесплатно mp3 все песни в хорошем качестве	yes	97.06%	
музыка из кф мюнхгаузен	музей островского в щелыкове	no	99.99%	
логарифм онлайн	вес младшего разряда	yes	79.69%	
amara luxury resort villas 5 кемер	EUPHORIA TEKIROVA 5*	yes	99.99%	
квартиры д.левошево шатура	купить блинную сковороду москве	no	100.00%	
слушать яндекс музыку	манник на кефире рецепт	no	99.99%	
выборг работа вакансии свежие	начальник перешел на личности	yes	96.58%	
Анатоксины используют для:	ПРИ КАКОМ ВОЗБУДИТЕЛЕ ПНЕВМОНИИ НАИБОЛЕЕ ЧАСТО НАБЛЮДАЕТСЯ ДЕСТРУКЦИЯ ЛЕГКИХ	no	99.99%	
открытка с поминальной свечой 	заказать листовое железо в размер нск	no	99.99%	
леруа мерлен тверь	валдберрисинтернет магазин тверь	yes	99.99%	
скачать плагин ezdrummer	скачать плагин virtual guitarist	yes	94.59%	
план-конспект искусство эпохи возрождения	учебники бай всемирная история 8 класс	no	86.52%	
ярёменко хуже не будет скачать	демарин не гляди назад скачать	yes	95.65%	
елена к яндекс дзен читать	записки консьержки яндекс дзен	yes	97.74%	
программа изобразительные искусства в начальной школе соответствуют образовательной области искусство обязательного минимума содержания	посредством образного отражения предметов и явлений действительности рисунок живопись декоративно прикладное искусство скульптуры	yes	85.92%	
зачем люди отправляются в путешествие итоговое сочинение	проверка сочинения на уникальность	no	95.46%	
уз кино	уз-кино 2020 янгилари	yes	99.99%	
прочитай скороговорку какие звуки в ней часто повторяются почему ехал грека	как ты думаешь что общего между устным народным творчеством и прикладным искусством	no	99.99%	
yuri manga read	adult read manga	yes	96.43%	
что означает местоимение	готовый причастие или прилагательное	yes	52.50%	
порно русские новое	новости красноярска	no	99.99%	
форум ситроен	настройка опускания зеркала вольво хс60	no	94.24%	
прибпвленте зсорлата гр ио рф	прибавка к зарплате бюджетникам гр мо рф	yes	100.00%	
пистолет для монтажной пены в волгограде ситилинк	Пистолет для монтажной пены Вихрь 73/3/6/4, 400ммитилинк	yes	99.99%	
рецепт суздальской медовухи	шишки хмеля купить в калининграде	no	70.19%	
ночные этюды	манга мой любимый полицейский	no	99.10%	
в windows 10 требует входить в учетную запись майкрософт	блокировать учетные записи Майкрософт	yes	99.61%	
переводчик с английского на русский	фундаментальные постройки	no	99.87%	
чай в пакетиках продажа	чай пятерочка ассортимент	yes	99.38%	
приморский край рельеф	qgis interpolation	no	99.94%	
баксан сад	ооо базис баксан	yes	99.99%	
смотреть бесплатно хорошие турецкие фильмы	смотреть бесплатно турецкий сериал на русском никогда не откажусь	yes	99.99%	
включи клип песни ты горишь как огонь	включи клип песни федерико	yes	73.56%	
пенза московская 72а индекс	уфсб по пензенской области	yes	98.57%	
шестой школьный день	единые дни здоровья	no	99.99%	
французский язык 8 класс вводный урок	la rentrée à l’école  текст	no	64.82%	
в каком году поделили польшу ссср и германия	Влияние гитлера деление европы	yes	99.99%	
серебро родированное	магазин славия в гомеле с подарочной каробочкой	no	99.77%	
Космическая биология наука о кратко	Кибернетика наука о кратко	no	82.96%	
легкая гиперстимуляция после переноса	запор и вздутие после переноса	no	59.97%	
черемушки москва	прокурор по району черемушки москва 	yes	99.37%	
куриное мясо польза для организма	Козерог и его бумеранг обидчику	no	99.99%	
как хранить помидоры на дозревание	запеченный сулугуни	no	99.44%	
ALBATROS CITADEL SAHL HASHEESH 5*	long beach resort hurghada	yes	68.63%	
kundelik kz	қазақстандағы 1916 жылғы ұлт азаттық қозғалыс қмж	yes	99.99%	
высота панелей санитарно гигиенические требования	какие предъявляются требования к организации торговли	yes	99.99%	
скачать песню лобода молоко	скачать песню марвин хочу чтобы история нашей любви бегала по дому	yes	95.50%	
статья психология клептомания	клептомания как девиантное поведение	yes	99.99%	
ним нем чередование корней	полагается скачите наклоняться	no	99.21%	
союзники германии в 1 мировой войне	кому принадлежала в 20 веке кубок филиппины никарагуа гаити	no	93.01%	
настроить хэнд ту ноут на покер старс	работает ли  хэнд ту ноут  при игре на фишки	yes	100.00%	
с днём рождения дочери для родителей	яндекс диск	no	99.30%	
извращенцы в метро в японии секс	японское порно телеграм без цензуры	yes	99.99%	
Штраф за невыполнение одной из сторон договорного обязательства	Банковская расчетная операция, при которой банк по поручению своего клиента принимает на себя обязательство получить платеж	no	99.99%	
Совершенствование профессиональных компетенций педагогов в условиях информационно-образовательного пространства дошкольной образовательной организации.	Повышение качества образовательного процесса в ДОУ посредством сетевого взаимодействия с социальными партнерами.	yes	100.00%	
самые дешевые дома для проживания и отдыха  в Ялте	расписание поездов со станции  Тимашевск до Крыма	no	99.99%	
качества 5 положительных качеств какой вы	авторская методика это	no	99.99%	
оперативный дежурный обязанности	рабочий высококвалифицированный обязанности	no	99.99%	
можно ли вернуть яркость глаз	лютеин для чего	no	97.63%	
арсеньев ДК прогресс	фокино МБУ ЦКИ спутник	no	85.46%	
hydrangea-nw.ru	семена для сибири купить	no	99.99%	
николь косметика кристина спб	книги майкл бейджент	no	99.25%	
максидент оренбург официальный сайт	монастырло оксана александровна оренбург максидент	yes	99.99%	
домофон с камерой в подъезд многоквартирного дома	17 свадьба какая	no	99.36%	
Алиса как нарисовать человека	Алиса как изменить код	yes	62.48%	
как обстоят дела в анапе на сегодняшний день	702 схема мдлп	no	99.35%	
саске ревнует наруто слэш	из наруто вытащили девятихвостого слэш	yes	99.99%	
диана шурыгина новый слив	близняшки из казани с фалоиметаторами	no	90.86%	
моргает иконка на табло машина ключом на тойота приус что это	что такое противоугонная система с иммобилайзером	no	57.97%	
retirns la nuit minus	retiens la nuit johnny hallyday minus	yes	99.99%	
лего набор раритет	лего набор раритет с джонни громом	yes	99.99%	
pirelli 195/65 r15 91v formula energy отзывы	протектор вологда	no	99.51%	
какие есть два угольных бассейна в кузбассе	численность населения кузбасса	no	99.99%	
я так кайфую от любви лови лови полная версия скачать	е каталог	no	99.23%	
образование предложений с наречиями в английском правило	английский язык 7 класс учебник	yes	99.59%	
батыршин ильмир ильдарович	становых татьяна николаевна	no	66.13%	
вебинар хорарная астрология	Астролог татьяна орлова	yes	99.99%	
паракортикальная зона лимфатического узла функции	мозговые тяжи лимфатических узлов процессы	yes	99.78%	
выписка из егрн в мфц какие документы нужны собственнику	выписка из егрн в мфц цена	yes	100.00%	
как отключить в доте загрузку экрана	дота 2 параметры запуска для слабых пк 2021	yes	100.00%	
мустафа сандал и зейнеп бастик мод скачать бесплатно mp3	ahmed khan byro paris deep house remix	no	95.50%	
aliens vs predator игра ps3	фэймос 2	no	81.59%	
авито ростов на дону бесплатные объявления от частных лиц	слушать радио для двоих онлайн бесплатно в хорошем качестве в прямом эфире	no	99.99%	
покрывало AXVERONIKA АКСВЕРОНИКА отзывы	ärtvicker эртвиккер отзывы	yes	70.27%	
Начинает разбор по составу	гдз по русскому языку 6 класс	yes	57.62%	
центр занятости тарасовский ростовская область вакансии	директор итеко в батайске	yes	59.88%	
кулинар техникум индустрии питания и услуг официальный сайт	поварская форма екатеринбург купить	no	91.84%	
рядовки коричневые съедобные	грибы с коричневой шляпкой	yes	99.99%	
скачать made in heaven	simmer down	yes	98.47%	
русский рок 2021	современный рок	yes	99.50%	
на прием инфо брянск	первая больница брянск	yes	95.90%	
Инфильтраты могут иметь различные размеры, окраску, форму и залегать на разной глубине. Образование может приобретать точечную, штрихованную, веткообразную, округлую форму или распространяться по всей роговице.    Исходя из клеточного состава, определяется цвет инфильтрата. Желтая окраска свидетельствует о гнойном процессе, серая о наличии скоплений лимфоидных клеток, а медная или красновато-коричн	Кератит по МКБ  В соответствии с Международным классификатором болезней 10-го пересмотра, кератит имеет код H16.	no	89.79%	
бесплатный аккаунт epic games с гта 5	как выдать оружие в кс го через консоль	yes	97.47%	
Autodesk AutoCAD 2019.1.1 (x64) crack	autocad 2019 kayıt yapmak	yes	99.99%	
посредник для заключение сделок	Вид бух отчётности 6	no	100.00%	
nutaku	геншин импак валяшка	yes	99.99%	
хроники акаши	хроники акаши аниме	yes	99.78%	
именины 29 февраля у кого	именины 9 февраля женские имена по церковному календарю	yes	93.49%	
ингибирит-п - пассивирующий состав для металла расход на м2	расход кварцевого песка при гидроабразивной очистке мойками высокого давления на 1 м2 металла	no	86.70%	
корень слова облако по составу	корень слова тетрадь	yes	99.67%	
чистов 1с видеокурсы	viessmann vitodens 100-w	no	99.99%	
гдз к лексико грамматическому практикуму 5 класс афанасьева	утепляем стену в туалете от соседей	no	99.99%	
одна из двух параллельных прямых плоскости a пересекает плоскость b	известно, что какие то три из данных 4 точек лежат на одной прямой, существует ли плоскость	yes	99.99%	
управление командной и рыночной экономики	элементы процесса управления	yes	60.38%	
молодежь картинки на прозрачном фоне	пальцы рисунок для детей	no	97.04%	
фильм 1905 года хвастуны с фермы в парке	фильм 1905 года христианские мученики	yes	99.99%	
департамент природопользования и охраны москвы	в лицензии продавец написал не полное название ружья	yes	99.99%	
миша городецкий новое	миша городецкий с чихуа хуа где живет?	yes	97.45%	
вопросы о жидком агрегатном состоянии	почему зимой вода в реке замерзает	yes	77.54%	
ужастик про зоолога за кабанами	фильм за бродом	yes	97.45%	
скачать фотошоп бесплатно на русском	как вырезать объект	yes	85.20%	
30+ yetişkinler için Türk filmleri	PORN yetişkinler için Türk filmleri	yes	94.59%	
базисный учебный план отражает следующие основные показатели исключите неверное выберите один ответ	В примерной программе в соответствии с ФГОС в достижении метапредметных результатов особое внимание уделяется проблеме: Выберите один ответ:  a. подготовки учащихся  b. сопоставления произведений  c. смыслового чтения	yes	88.33%	
по составу проверенное	по составу старинная	yes	99.99%	
что такое контекстуальный антоним	что такое просторечное слово	yes	99.99%	
Перечислите признаки уголовно-правового применения	применение уголовного права	yes	99.99%	
перевод с английского на русский snowball	перевод с английского на русский wales	yes	99.99%	
санхоум гадание	тёмный мир равновесие 1 сезон 9 серия	no	99.99%	
куда слетать на новый год	туры в мексику на новый год 2022	yes	98.63%	
песни мурцаева поо ислам	шахид это террорист	no	99.99%	
песенка ко дню мамы	есть мама у котенка детская песня плюс и минус	yes	100.00%	
Краб сыр майонез	Начинки для суши из краба и сыра	yes	99.99%	
можно ли пить алкоголь в антикафе	антикафе москва	yes	99.99%	
копченый табак сорта	кентукки сигареты с табаком	yes	99.99%	
10 стран по численности населения более 100 млн человек	5 полуостровных стран 5 островных 5 стран архипелагов	yes	99.99%	
navien deluxe coaxial 24 k купить	моя родня	no	91.44%	
"Сериал ""Игра на выживание"" - 1 серия"	игра на выживание 2	yes	99.99%	
вологда погода сегодня	ногти две руки разными цветами дизайн 2021	no	99.99%	
смотреть онлайн фильм татьянин день	кого пасха 2022 года	no	99.44%	
школьный портал	как называется корабль на котором царь пелий отправляет юного ясона в колхиду	no	100.00%	
погода сосновоборск пензенская область	xiaomi redmi note 10 pro купить	no	99.27%	
Механизм Глоссарий	мегаполис Глоссарий	yes	99.99%	
что нужно сделать в самом начале общения с клиентом	на каком расстоянии от красного щита укладывается первая петарда	no	97.74%	
порнофильмы песни	россия для грустных скачать	no	99.99%	
купить оптический кабель	onkyo tx-sr607 инструкция	yes	99.43%	
Отар Кушанашвили	Витамин, способствующий правильному усвоению кальция и фосфора:	no	93.83%	
какие прилагательные характеризуют свойства воды жидкая бесцветная белая ароматная	из перечня химических терминов и определений подберите синонимы к понятию сложное вещество	no	62.72%	
Я иду искать фильм	приступы кашля у кошки	no	98.25%	
периодичность проведения узи по медицинским показаниям	состояние здоровья свидетельствует об отсутствии показаний для проведения повторного узи	yes	99.99%	
bokep anak sklh	bokep anak ma	yes	100.00%	
зарождение производящего хозяйства	что такое земледелие	yes	97.70%	
гдз по окружающему миру 3 класс рабочая тетрадь плешаков 1 часть	заповедники армении список	no	99.32%	
вычитание рациональных дробей	как вычесть целое число из дроби с целым числом	yes	100.00%	
севашко а в звукорежиссура и запись фонограмм скачать	история звукозаписи	no	85.73%	
курентзис билеты	по номиналу	no	99.73%	
Для контроля достоверности учета электроэнергии на подстанции назначается комиссия, которая что составляет	Какими измеряются приборами потери электроэнергии в силовых трансформаторах	yes	91.22%	
презент симпл	what your husband work hes a hotel manager	yes	52.88%	
выборы в госдуму 2021 предварительные результаты	счастье мое все для тебя сердце мое бьется любя	no	77.69%	
лучшие фильмы	Реквием по мечте	yes	99.35%	
стройка гомель каталог с ценами гомель	кисть радиаторная 25 мм	no	99.99%	
что делать при температуре 39 у взрослого	глазная боль температура 39	yes	99.99%	
избиение кидал	как расшифровывается морг	no	100.00%	
look at the pictures choose the words in brackets and complete the sentences	write the words the box in the appropriate columns	no	91.77%	
роберт пири  даты открытий	руал амундсен вклад	yes	86.30%	
жука самого красивого в мире	машеньке откуда берется дождь	no	99.99%	
Ограничения применения амортизационной премии к затратам на повторную реконструкцию	Нужно ли начислять страховые взносы на суммы, по которым подотчетник вовремя не отчитался, если работодатель решил не удерживать эти суммы из его зарплаты?	yes	96.70%	
