INPUT:text1	INPUT:text2	OUTPUT:result	CONFIDENCE:result	
микростатьи с фото куколд	семейная пара сексвайф куколд ищет господина сосем лидем трахвесся во все дырки полностью опущены оба копро зоо без табу на цепь	yes	86.01%	
самое жаркое место в мире	виталий гогунский	no	99.99%	
рут права на mt 6797	как получить рут права на андроид 10 без компьютера	yes	99.99%	
севротонус препарат гинко билоба	концептуализация понятия доброжелательность	no	99.72%	
иван висковатый это	алексей адашев	no	74.66%	
Шаши капур	после принятия эскапела через сколько надо сделать тест	no	90.15%	
каков предмет ее исследования философии	Что такое мировоззрение. Его характеристика.	yes	59.89%	
как вы считаете особая форма художественного познания мира и человека средствами литературы	найдите позицию которая является обобщающей для всех остальных позиций представленного ниже ряда и укажите кк	yes	99.94%	
г. Красноярск, ул. Карамзина, 10 индекс	г. Красноярск, пр-кт. 60 лет образования СССР, 24а индекс	yes	100.00%	
сравнить числа онлайн калькулятор	сравнить числа онлайн в степени и дроби	yes	92.43%	
рик и морти	рик и морти 5 сезон смотреть онлайн	yes	99.95%	
Щедрин Иван Антипович 1916	Гречаный Алексей Семёнович 1918	yes	97.11%	
многие художники при создании своих картин обращались к былинам	былина это 7 класс чему учит , смысл	no	85.94%	
bokep indo kdrt	bokep indo mom	yes	99.99%	
пламя снег кружится	я больше не прошу мираж скачать	yes	100.00%	
закон о банкротстве 61,9	глаголев роман александрович	no	99.99%	
оптический модем с опцией wi fi medium ростелеком	тв приставка wink ростелеком	yes	99.99%	
20 км в час сколько узлов морских	оптимальная скорость яхты на двигателе в море	yes	88.27%	
суп с белыми грибами свежими рецепт	аэратор для смесителя	no	99.99%	
лучшие книги скачать	бикс+ улан-удэ официальный сайт телефон диспетчера	no	99.42%	
"конкурса ""Маленькие таланты России"	конкурсы для детей краснодар	yes	99.99%	
gtp-tabs.ru	тверской район фасадная вывеска	no	98.99%	
озорных разбор слова по составу	тишине тишь	no	95.86%	
да мне по утюгу	Мне похуй на сленге	no	53.64%	
стикеры с стрей кидс	ран бтс	no	67.99%	
земфира почта	мумий тролль море гудбай	no	52.35%	
белье постельное детское	пододеяльник 1 5 спальный размер	yes	99.99%	
управление загс администрации города оренбурга свидетельство	статья 206 ук рф	no	99.99%	
билеты в стамбул из москвы на самолете из москвы цена 2021	как поехать в турцию сейчас из россии	yes	99.72%	
примерами реальных социальных групп являются профессиональные объединения	социальная группа статусные функции	yes	99.99%	
как получить снежки командой в кс го	как возвродиться себя в ксго	no	97.82%	
риторические фигуры	соня мармеладова	no	99.19%	
чем воняет моча при почечной	лодэ брест пионерская	no	100.00%	
ком либо или ком-либо	царевна лягушка тема	no	99.95%	
Когда наконец то нашла нормальную подругу тикток	видео тик ток когда нашла подругу которая не копирует мой стиль	yes	99.99%	
молодое плодовое растение высаженное из теплицы на воздух 8	слово обозначающее предмет или явление 8 букв	yes	99.59%	
клиника зоо экстра спб	как сделать карту с обозначениями в кс го	no	95.71%	
Құран мен Сунна	ватсап ватсап веб веб	no	99.99%	
Для работы с детьми раннего возраста воспитатель подбирает материал, ориентируясь на:	Использование специфических, культурно фиксированных предметных действий, знание назначения бытовых предметов (ложки, расчески, карандаша и пр.) является целевым ориентиром для развития детей:	yes	99.99%	
mazda 6 3 поколение дорожный просвет	Узел Патрубок воздушного фильтра	no	99.99%	
атрикс краснодар	атрикс краснодар детские площадки официальный сайт	yes	99.99%	
как прошить ps3 чтобы скачивать игры бесплатно	убилава реваз	no	99.99%	
"Какие предложения могут быть к схеме А:""А?"""	предложение с прямой речью 6 класс русский язык	yes	99.99%	
На какой срок может быть заключен трудовой договор с работником?	Какое из перечисленных утверждений соответствует требованиям Трудового кодекса Российской Федерации к заключению трудового договора?	yes	99.99%	
Юпитер в 1 доме в карте релокации	Северный узел в 11 доме в карте релокации	yes	99.99%	
простая девичья фамилия	как нарезать арбуз	no	99.97%	
canlı maç izle	bein sports canlı izle	yes	86.99%	
Инн 7709876489	24.44.23 окпд2	no	99.99%	
Тумба под сверлильный станок в самаре купить	Как правильно расположить в мастерской наждак, сверлильный и тиски	yes	53.60%	
радио онлайн слушать бесплатно	контрольные тест на 4 5 параграф история россии 7 класс	no	97.52%	
Ролл терри	капли для носа беременным	no	98.69%	
Суржиков Роман – Полари	суржиков роман поларис по порядку	yes	99.99%	
molly kelt биография порно актриса	хәйерле иртә видео башкирское	no	100.00%	
любовь которой стоит заняться epub	массовый вкус мем	no	99.99%	
песня какой гандон	песня илья залепи гудок	yes	100.00%	
рассказ про свой дом 10 класс	решебник по геометрии 10 класс	yes	99.99%	
голландские пейзажисты не писали величественных панорам и классических руин егэ	современные тооковые чловари дпют стилисттческие	no	98.43%	
метро схема	стажировка в озоне отзывы сотрудников	no	99.99%	
Расставить коэффициенты в реакциях и определить их тип H2+TiO2=Ti+H2O	расставьте коэффициенты в схемах реакций	yes	99.99%	
Look! Dan__ (play) the guitar! какое слово вставить в пропуск	Ьн ышыеук тумук ___ (рфму) икуфлафые фе 7.00	yes	99.99%	
би 2 варвара	гдз по алгебре	no	100.00%	
ужасы 2021 смотреть онлайн бесплатно в хорошем качестве	клаустрофобы 2 лига выживших фильм 2021 смотреть онлайн бесплатно	yes	93.04%	
тепловая пушка 9 квт на 380	Набор ударных клейм по металлу, цифровые, арабские, 5мм (Зубр), 1 шт.	no	99.99%	
рыбной порт вакансия тальман	мыть моторы в летных	no	72.35%	
работа в иланском	центр занятости иланский	yes	99.25%	
воронеж-симферополь самолет прямой рейс цена расписание 2021	аквапарк белгород цена	no	99.94%	
В каком количестве на рабочем месте должны храниться горючие вещества?	Как по характеру и времени проведения подразделяются противопожарные инструктажи?	yes	96.85%	
методики исследования памяти	методики исследования стресса	yes	99.99%	
blanco мойки официальный сайт	школа с государственной аттестацией	no	99.92%	
изменение рн раствора в стеклянных бутылках	isfet электрод	no	99.67%	
скачать brawl stars	скачать приложение в котором ты будешь собирать фуры и кататься на них	yes	62.93%	
антуриум барнаул официальный сайт	эдарби инструкция	no	95.99%	
явка на выборы ставропольский край	сбербанк онлайн	no	99.99%	
высшие растения используют споры для бесполого размножения а для чего необходимы споры бактериям	мейоз оогенез и спермогинез	no	62.86%	
пришвин кладовая солнце краткое содержание	лисичкин хлеб пришвин краткое содержание	yes	99.99%	
рок металл слушать в хорошем качестве	с днём рождения тебя любимый мой	no	99.99%	
Назовите страну, в которой традиционный головной убор называется САМБРЕРРО. Перечислите названия танцев, известных в этой стране.	мексиканские танцы названия	yes	98.33%	
купить маникюрные кусачки для ногтей	плюсы традиционной экономической системы	no	99.99%	
памятники в краснодаре	хабаровск достопримечательности города фото с описанием	yes	96.33%	
почётные портные дорама русская озвучка	Программа мужское женское закрыто	no	99.99%	
магазин шин в пензе ростовская	шины пенза	yes	99.99%	
печенье сколько слогов в слове	яуа кайын япрагы песня	no	99.99%	
Если в создавшейся обстановке могут возникнуть основания для применения огнестрельного оружия..  Сотрудник полиции имеет право произвести предупредительный выстрел..  Сотрудник полиции имеет право предупредить правонарушителя, что он обнажит огнестрельное оружие и приведет его в готовность..	Сотрудник полиции имеет право применять огнестрельное оружие для отражения группового или вооруженного нападения на здания, помещения, сооружения и иные объекты ...  консульств  общественных объединений  представительств  государственных и муниципальных органов	yes	99.99%	
практика березовая	спортивные сборы по плаванию в нижнем новгороде 	no	99.99%	
дочь просит полизать	женщины барабинска для секса	yes	86.50%	
безлимитный мегафон	как долго я тебя ждала	no	99.94%	
чм 22 группа h	обзор португалия ирландия	no	82.55%	
в пермском мед университете нет трупов	в мед институте инзапретили изучениеианатомии на трупах	yes	99.99%	
леруа мерлен иркутск каталог	метр иркутск каталог товаров цены	yes	63.82%	
сколько живет муравей	Откуда произошёл алах	yes	62.48%	
москва брянск автобус   расписание	: Автовокзал Саларьево на карте	yes	76.80%	
схожие формы правления	парламентарная монархия характерные черты	yes	97.19%	
установка биде расценка в смете	кран для стиральной машины расценка в смете	no	76.56%	
кабачки с фаршем и помидорами и сыром запеченные в духовке рецепт	фарш говяжий мираторг  в гулливере в ульяновске на московском шоссе	no	99.99%	
игра онлайн где против оборотней	игра онлайн на пк	yes	99.91%	
вилла империя аршан	Аршан саянская 16б	yes	99.91%	
как спрятать проводку в стене без штробления	как уложит тв кабель в квартире м ремонтом	yes	98.74%	
ирина дубцова люба-любовь слушать	вера брежнева ищу тебя слушать	yes	99.99%	
пцр отрицательный при коронавирусе форум	кладовка бел	no	99.86%	
4 Gb - Samsung 1R*8 PC3L-12800S-11-12-B4	"15.6"" ноутбук lenovo thinkpad e531 какая оперативная память"	yes	84.83%	
город кемерово кгуп	кемеровский университет	yes	98.48%	
корал тревел туроператор	seaden valentine resort spa	no	88.56%	
перечислите основные причины великих географических открытий	раздел сущ прил гл составить 20 словосочетаний по всем правилам	no	99.99%	
должник по кредиту проверить б	судебные приставы узнать задолженность по фамилии курская область	yes	85.64%	
хочу в питер одноклассники	чашка кофе в одноклассниках группа	yes	96.50%	
игра паук пасьянс играть бесплатно 1 масть масти играть бесплатно	игра солитер играть бесплатно онлайн	yes	99.60%	
обратный клапан на насос скважины отсекатель не включается	реле давления на осной	yes	99.92%	
сколько солнечных дней в магадане в среднем	поселок шелехово камчатский край	no	99.80%	
сива гранд бич хургада	корал бич резорт хургада	yes	99.99%	
Из какой части зубного зачатка образуется периодонт	Устья корневых каналов не выражены	yes	83.47%	
гост 8639-82 трубы стальные квадратные	гост 30245-2003 прямоугольный гнутый профиль сортамент	yes	99.99%	
систематика дикой утка	к какому роду относится утка дикая	yes	100.00%	
западное управление мвд на транспорте	Западное линейное управление МВД России на транспорте прокуратура контролирует	yes	99.99%	
зоны таможенного контроля могут быть	страна в котором товар был полностью произведен это	no	88.12%	
в 1654 году в состав россии по решению переяславской рады вошла	в конце xvii в россии появился новый архитектурный стиль получивший название московского нарышкинского	no	91.77%	
большеречье омская область где поесть	запись на прием к врачу омск через интернет	no	99.99%	
порно	навьен 13 к технические характеристики	no	99.99%	
европа плюс слушать онлайн	dancing on dangerous скачать	yes	88.33%	
ваз 2110 папирус	автосалон центральный ярославль	yes	99.99%	
тв 1000 программа	тв звезда программа передач на сегодня	yes	99.98%	
большие весы на складе 4 буквы сканворд	жрец-прорицатель 6 букв	yes	68.63%	
гдз английский 3 класс рабочая тетрадь афанасьева	картинки с добрым утром осенние	no	98.17%	
груша рогнеда	дачный мир казань каталог	no	81.87%	
апрель смысловые галлюцинации текст песни	танцы минус не меняй меня	yes	100.00%	
авария на маломерном судне куда звонить?	министерство транспорта приказ 221	yes	69.35%	
невская битва	созыв первого земского собора	no	99.94%	
причины пропадания звука на компьютере	как узнать параметры компьютера на windows 10	yes	99.99%	
вино Lefkadia Valley	Sikori Vinery	yes	99.99%	
сколько стоит штраф за проезд на красный	сколько стоит	yes	99.99%	
как открыть пункт Topdelivery	открыть пункт выдачи my-shop.ru	yes	99.58%	
ленин фото в цвете	казаки во время гражданской войны	no	99.51%	
крюгерка настройка стабильной скорости	крюгерка настройка	yes	99.99%	
so far present perfect	for results	yes	79.61%	
как дома заблокировать колесо в домашних условиях	как заклеить бескамерную шину не снимая колеса	yes	84.40%	
сбербанк корпоративный отдел саяногорск	кредит для начинающих ип с нуля	no	55.36%	
гд рф	закон о запрете списаний пенсий и тд и гарантированный ежемесячный доход	no	55.73%	
сколько нужно кабин для тайного голосования если число избирателей 1315	расчет размера дополнительной оплаты труда уик с правом решающего голоса производится на основании	no	96.65%	
омар кустов балаково	тополева алёна александровна балаково	yes	99.99%	
изба читальня елена наумова	мега хенд липецк	no	99.51%	
размер плодного яйца по неделям	размер плодного яйца 3,6 мм	yes	100.00%	
что делать если поставил драйвера	майами вайс	no	99.36%	
divisat сбросить пароль	как сбросить регистратор divi	yes	99.99%	
швейная фабрика учалы видео	ГАОУ ДПО РБ «Учебный центр ГСЗН»	no	98.15%	
когда уйдем со школьного двора	орловская зам председателя центризбиркома	no	95.41%	
одноклассники моя страница	программа цифрового телевидения на сегодня	no	94.49%	
контейнер для мусора настольный	с днём рождения	no	97.41%	
работа в валберис тюмень вакансии	мойка со столом из нержавейки.для мытья мяса и рыбы	no	91.71%	
магистратура бесплатно	master programs france	no	99.71%	
спасское лутовиново афиша сентябрь 2021	афиша театра тургенева в орле 2021	yes	99.99%	
djvu to pdf	djvu reader	yes	99.99%	
какие работы можно выполнять ультразвуковой сварки	основные способы пайки	yes	90.53%	
судебные иски на УК Девятка	ук девятка ставрополь	yes	83.61%	
авиа билеты дешёвые купить	как доехать от ялты до адлера	yes	99.99%	
Каким был замысел сервантеса в создании своего произведения	Почему дон кихот сражался с ветряными мельницами	yes	99.27%	
6 кадров 134 выпуск	даёшь молодёжь 134 выпуск	yes	97.81%	
американка для полипропиленовых труб 25	резьба 1 дюйм в мм трубная	no	73.79%	
усьва гостиницы	как отметить годовщину свадьбы пермь	no	97.18%	
скачать бесплатно подборку песен с днем рождения	скачать бесплатно песню а целый мир еще не знает	yes	99.99%	
работаю рядовым сотрудником а как уйду  без меня никуда	середкина мария иваново	no	98.63%	
фотосессия в лесу походная	юлия копытова	no	99.90%	
Розалия Самуиловна Землячка	маргарита назарова актеры и роли	yes	74.09%	
тургон река узбекистан сурхондарё бойсун район деревня Дербенте	тургон река это где находится	yes	99.99%	
в каком году жители рима отметят 3000 летие своего города вычисления	гдз по истории 5 класс рабочая тетрадь 1 часть годер 2020 год счет лет в истории 5 задание	no	94.99%	
кабардинка погода	диана арбенина биография	no	99.48%	
открыть замок квартиры Саратов	открыть машину	yes	86.12%	
инвитро казань адреса время работы	пцр тест для выезда за границу на английском	no	98.35%	
вид древесных растений семейства ореховых , распространенный на юго - востоке США	олег газманов биография семья жена первая	no	99.86%	
youtube ios 8.4.1 какая версия	youtube на старых ipad	yes	92.86%	
мы берем напрокат самый быстрый самокат слушать онлайн бесплатно	мия бойко песни	no	89.44%	
кунг фу панда против марвел	бэтмен против железный человек	yes	70.11%	
как в работе измеряют давление и объем газа	обозначение и общая формула дыхания в физике	yes	99.99%	
окфо тумбочка	тумбочка окоф 2021	yes	99.99%	
фильм ред	фильм ред карл урбан	yes	99.99%	
в инстаграмм не все истории грузятся	премьер промокод	no	99.96%	
Владимир Сактоев скандал	евгения соктоева дочь ректора	yes	99.99%	
