INPUT:text1	INPUT:text2	OUTPUT:result	CONFIDENCE:result	
для определения рутения и осмия в	распределительная хроматография белков применение	no	72.61%	
штифт с подпружиненным кольцом	шплинт быстросъемный пружинный в леруа мерлен	yes	94.09%	
голд вэй логистик номер телефона	ооо кверкус групп номер телефона	no	81.20%	
гдз по русскому т. Г рамзаева3 класс 1 часть учебник стр 24 упр 47	сапоги скороходы сказка	no	86.99%	
Выделяют в качестве вида общения непосредственное и опосредствованное?	Отстранённая позиция коммуникатора характеризуется	no	99.99%	
что пить при ломоте в пояснице при коронавирусе	9 й день коронавируса неприятные ощущения в грудине	yes	99.99%	
заявка на микрозайм zaimino	новые микрозаймы онлайн займино	yes	100.00%	
испания 2021 ноябрь	горящие туры на мальдивы	yes	69.46%	
к чему снится кража денег и кошелька	выплаты по больничному в узбекистане	no	96.84%	
break this the breaking point 2	Хентай бог скачать	no	99.99%	
ребенок хочет спать что предпримет бихевиреорис	восприятия делятся на	no	97.36%	
играть маднесс комбат проект нексус 2	играть в майнкрафт	yes	100.00%	
врач гинеколог онлайн консультация бесплатно без регистрации ответ сразу	может ли гинеколог	yes	99.99%	
росдистант личный кабинет войти	Become A Rock Star	no	84.16%	
как расшифровывается аббревиатуру ЕГО	будут учиться дистанционно	no	99.99%	
dr	инструменты для осмотра полости рта	no	99.99%	
купить гараж в кирове в октябрьском районе	дзержинского  97	no	72.07%	
Большие черные обвисшие сиськи	Продавщица порно	no	90.62%	
5М обмотки сенатора	сфера влияния животного 5 букв	no	99.99%	
скачать песню из сериала патриот в начале сериала	скачать песню со слова на станции союз запахнет йодом	yes	99.99%	
5 сентября видео	карусель карусель начинает рассказ скачать	no	100.00%	
как подключить телевизор лджи к вай фай	under the sea суши спб	no	99.99%	
танец китри слушать	племянник по-английски	no	83.70%	
основные фармакологические эффекты анальгетиков-антипиретиков	механизм действия анальгетиков антисептиков	no	83.70%	
виктория жирова ессентуки	г.ессентуки ул октябрьская д 468	no	95.74%	
на каких участках Петербурга отменили выборы	горизбирком санкт-петербурга официальный сайт	yes	63.30%	
лекарственное вещество это	чем заканчивается рецепт в фармакологии	no	91.00%	
НЕЙРОМИДИН 0,015/МЛ	сравни ру	no	99.99%	
труд футбольный клуб воронеж	дневник ру через госуслуги	no	99.99%	
постройте графики зависимости проекции векторов скорости от времени для 3 автомобилей движущихся прямолинейно и равномерно если 2 из них	координаты тела движущегося прямолинейно	yes	99.99%	
look at the advert and answer the questions what is the hobby what do people do	домашнее порно	no	92.00%	
Как сделать чтобы не было видно печатания	я умею звонить вашим друзьям в контакте	no	97.38%	
Где можно получить профессию столяра в москве	дпо профессионал	no	91.84%	
татьяна вендер дзен сегодня	хомяк из краснодара ютуб	no	99.99%	
самсунг галакси а 01 разрешение экрана	как создать новый рабочий стол в андроид 11 GO	no	81.37%	
скачать песни на звонок	включи песни песни кучина	yes	99.99%	
может ли лопнуть мочевой пузырь	расширенная лоханка почки что это значит у взрослого	yes	99.99%	
проверить скорость интернета	что такое амплитуда колебаний	no	94.54%	
терапевт значение с латыни	основные синдромы анемии железодефицитной	no	99.99%	
какой подход позволяет выделить основные результаты обучения и воспитания в контексте ключевых задач программы детствр	основные принципы комплексной программы детство по фгос	yes	99.99%	
отвести на англ в прошедшем времени	отвела на английском языке	yes	100.00%	
лизавета народная тлт нет?	фольклор это	no	99.99%	
"ОО ""ТСМС"" Екатеринбург"	тел   343-383-88-52	no	99.99%	
магнит акции	пятерочка акции	yes	99.99%	
Сергей Суслов	First Line Software	no	99.99%	
как найти наименьшее общее кратное трех натуральных чисел	как найти нок чисел 30 и 40	no	51.48%	
вебинар фсс 22.09.2021 регистрация	мосэнергосбыт личный кабинет	no	91.06%	
увольнение работников безработица тк рф	гос гарантия по обеспечению прав работников и работодателей осущ гос контроля	yes	97.65%	
смотреть фильм прямая трансляция онлайн бесплатно в хорошем качестве	смотреть кино забавные игры 1997	no	66.78%	
каркас из металла	жак саратов прайс-лист цена	no	89.08%	
собирайся мы едем на дачу видео	забота у нас такая	no	80.52%	
200 строк гуф	с какой скоростью растет борода у мужчин	no	100.00%	
егэ-2022 математика тематический тренинг базовый уровень	проститутка марина таганрог	no	99.99%	
картинка путешествия для детей	картинки знаменитых путешественников	yes	70.70%	
новосибирская область галина якушева найти фонд солнечный город	новосибирская обл черепаново галина дмитриевна якушева	yes	99.99%	
ягода малинка хабиба скачать песню бесплатно	клава кока слушать	no	87.34%	
гисметео москва	инвитро официальный сайт	no	89.07%	
чем запрещается производить отогрев замороженных трубопроводов унитазов сливных труб умывальных чаш кранов и вентилей сдо	в каком объеме экипируются вагоны твердым топливом в зимний период времени сдо	yes	99.99%	
детская сказка волшебные дудочки русское	произведение искусства в котором говорится музыканте или музыкальном инструменте	no	97.72%	
клиника чайка в крылатском	валберис интернет-магазин	no	99.99%	
Подсос воздуха через вут 4s fe	как работает вут 4s fe	yes	100.00%	
великолепный век смотреть киного сс	тв3 онлайн смотреть бесплатно прямой эфир в хорошем качестве	no	50.12%	
вебинар фсс прямые выплаты	вебинар фсс 22.09.2021 регистрация	yes	99.99%	
какие лампочки ставятся в противотуманки камри 40	как снять омыватели фар тойота камри 40	yes	99.99%	
канал пятница программа на неделю	поломались волосы что делать	no	99.99%	
картинки левша лесков	картинки лошадиная фамилия	yes	99.99%	
цены на кирпичную кладку в москве и московской области под ключ	сетка для кладки	no	61.99%	
нехорошо от жары как пишется	не робкого вида как пишется слитно или раздельно	yes	88.83%	
бекетова 13 нижний новгород	гдз по физике 10 класс мякишев	no	99.99%	
мортал комбат 2021	пила 9	no	53.23%	
дром кемерово	стоит ли покупать машину 2019 года сейчас	no	72.43%	
красные пятна, белый ландыш указать род и число	русский язык 4 класс 1 часть учебник моро	yes	86.23%	
ватсап веб	игры на английском для детей распечатать	no	99.39%	
тинао расшифровка округа москвы	слетать ру официальный сайт	no	91.71%	
future simple	future perfect continuous	yes	99.99%	
лазерное удаление шрамов	почему человек дергается во сне постоянно	no	99.99%	
инфоурок переподготовки для учителей дистанционно	инфоурок личный	yes	99.99%	
москитные сетки в краснодаре цены с установкой	москитные сетки краснодар	yes	100.00%	
анализ рассказа гранатовый браслет	главные темы и основные проблемы  рассказа гранатовый браслет	yes	99.99%	
gregorian sadisfaction 1991 слушать	smile sarah brightman слушать	yes	92.04%	
авито грозный авто с пробегом	авито ингушетия	yes	99.99%	
франьянц анна нерехта в контак	ирина кубанская ютуб	yes	77.53%	
реалии бытия в рассказе чистый понедельник в тексте	религиозные праздники в чистом понедельнике	yes	99.61%	
Илья страшко 35 лет	а мой мальчик едет на девятке по автостраде	no	99.99%	
медицинская физика это	как найти скорость кровотока в сосудах	yes	72.83%	
OTIUM FAMILY CLUB MARINE BEACH	Adora Calma Beach Hotel	no	99.99%	
фильм легенда трейлер	фильм контейнер	yes	98.77%	
порно скрытой камерой	а ты меня забыла была была	no	100.00%	
неразложимым сочетанием	не знаю как тебе запятая	yes	66.80%	
когда кладут а санаторий после удаления желчного пузыря приказ о долечивании	после удаления желчного пузыря диета в первые дни	yes	91.32%	
калькулятор налог на недвижимость	алименты с продажи недвижимости	yes	99.99%	
прогноз погоды в москве	встраиваемый холодильник бош	no	99.99%	
The amazing Miranda Pinocchio subdues the slave with her huge	porn hairy	yes	81.91%	
как оттереть рельефную плитку со стены	кэтрин коути википедия	no	99.32%	
миша маваши все хорошо	миша маваши гуманность	yes	99.72%	
общие положения об обязательствах	отдельные способы прекращения обязательств	yes	98.78%	
что посетить в питере этажи	massimo dutti	no	99.99%	
сколько муниципальных образований в краснодарском крае	описание опыта йод и картошка 5 класс	no	100.00%	
физминутка транспорт	музыка для сна для малышей	no	69.21%	
дзержинский лакокрасочный завод	измена мужу в контакте	no	99.99%	
театр оперы и балета самара официальный сайт	заведующий апк 6 тольятти	no	100.00%	
кирилл дыцевич фильмография	каждому свое чем закончится фильм	no	69.49%	
что такое вонголе	моремания в куркино меню	no	99.99%	
счётчик электроэнергии меркурий	кабель вббшв 5х16 цена за метр	no	99.99%	
нефростен инструкция по применению	канефрон инструкция	yes	99.68%	
Пердоз инфо	коми-пермяцкий агротехнический техникум официальный сайт	no	100.00%	
к в абрамян техприбор почта	закс ру	no	99.96%	
A master URL must be set in your configuration	sparksession connect to hive	no	99.31%	
читать порно рассказы	видео жену ебет гинеколог	yes	90.06%	
чему учат исторические музеи	аннотация по краеведческому музею	yes	99.29%	
кто победил	кто победил на выборах в россии в 2021 году	yes	99.03%	
поправки в ук рф в 2021 по ст 72	перерасчет  сроков на строгом режиме кому положено	yes	53.65%	
когда в отпуске	приятного отдыха	yes	95.10%	
семейство элемента азот	Характер элемента и простого вещества азот	yes	99.88%	
алексей алексеевич томский	Денис Александрович Гольбин	yes	99.77%	
как приготовить шаньги	приготовить яйцо бенедикт	yes	99.99%	
синица залетела в дом к чему это	приведи пример связи между человеком и неживой природой	no	99.99%	
аэрофлот поиск по номеру билета	аэрофлот багаж норма	yes	99.99%	
пр ленина нижний новгород магазин trives	Пр. Ленина, 54	yes	99.99%	
redmi 7 64гб цена Калининград	сколько квадратов на 6 соток земли	no	99.51%	
лекарство при сильном кашле с мокротой	коделак бронхо купить в Ялте	yes	99.95%	
фильм в котором пошел кислотный дождь	клаустрофобия 2	yes	65.04%	
проверка значения в массиве js	Expression expected.javascript	yes	79.65%	
после 3 смотреть онлайн	после 3 смотреть онлайн бесплатно в хорошем качестве на русском языке полностью 2021 фильм	yes	99.96%	
косгу 214 в 2021 году для бюджетных учреждений	выплаты заработной платы при смерти работника	no	99.99%	
сочинение о славе науке 7 класс	Наталия Александровна Петрова	no	99.99%	
крупнейшая  перевод на английский	задания по олимпиаде по русскому языку 5 класс с ответами	no	99.99%	
mike emilio i gir l	mike emilio i girl like	yes	99.75%	
районы москвы на карте с границами KML скачать	районы москвы на карте с границами гугл карты	yes	99.98%	
как посмотреть отправленные заявки на линке	александр власов аффект	no	99.20%	
чем закончится сериал дуэт по праву с кем останется татьяна	как приготовить стейк форели в духовке сочной и мягкой	no	99.43%	
как сделать локацию через блендер	какое уравнение называют линейным уравнением с одной переменной	no	85.30%	
Сетевое хранилище NAS из роутера tp link	total commander	no	99.32%	
сериалы с высоким рейтингом нетфлих	Джессика джонс про что сериал	yes	99.05%	
порно с мариной висконти	аудиокнига метро 2033	no	99.99%	
узнать очередь в детский сад екатеринбург	248 сад екатеринбург детский форум юмама	no	95.92%	
одномандатный округ бибирево итоги выборов	итоги выборов 2021	yes	100.00%	
Seagate Nytro 3731	лучший серверный hdd 2021	no	84.76%	
data oriented design	устройство игрового движка книга	no	99.25%	
Пила цепная аккумуляторная ELITECH	спецназ парусное	no	99.15%	
жезказган қаласының туған күні	қарағанды қаласының туған күні	yes	99.99%	
abba piano	una mattina	no	99.17%	
стояк маленький у сына	мама заметила что у сына маленький хуй и решила помочь	yes	99.99%	
что такое 1 практика и 2 практика в колледже	бригада в колледже	no	68.29%	
опущение почки на 6см какая стадия	купить хендетнксон симферополь	no	99.65%	
память народа	249-я эстонская стрелковая дивизия	no	98.74%	
рестораны на парке победы в спб	чито гврито спб парк победы	no	72.85%	
экономическое объяснение религиозных явлений предлагает теория	работа м.вебера посвящённая взаимосвязи конфессиональной принадлежности и трудовой этики называется	no	99.99%	
ротвейлер смешанный с дворнягой толстый	анна михайловская	no	99.99%	
медиа гет	играть в ракшаса	yes	98.65%	
погода в ижевске	продуктивность это	no	97.93%	
клиника семейная медицина липецк	медклиники липецк	yes	99.85%	
ты пахнешь любовью дорама десять лет спустя	никогда не покинешь дорама русская озвучка	yes	98.07%	
машины в дербенте билли джин в маккензи за 200000 за 50000 100000 тагаз	алиса я сказала молодую порнуху	no	99.21%	
малибу алушта	легенда крыма поповка	yes	99.99%	
переплетённые фильм 2019	марианна сериал	no	70.97%	
согласование с фас 44 фз единственный поставщик	ч 5 ст. 55.1 44	no	83.82%	
Lily Hall porno skachat	Sister family porno skachat	yes	99.99%	
Арабские Эмираты горячие путёвки на октябрь	арабские эмираты отели 18 плюс	yes	99.99%	
положена ли военным пенсионерам по инвалидности выплата в 10000 руб	лес энд море курск	no	99.64%	
булгаков вьюга	полотенце с петухом михаил булгаков	yes	99.99%	
майские указы президента 2012 о повышении зарплаты бюджетникам прочесть	могу ли принять работника с высшим образование не профельным, но прошедшего передоготовку	no	99.97%	
кривошеев андрей владимирович губкин	овсянникова марина губкин	yes	99.99%	
неравенство в россии 1990 годов относится к микроэкономике или нет	уровень монополизации испанского рынка ноутбуков относится к чему	no	95.97%	
солнечные зайчики все серии подряд	сказка иван-крестьянский сын и чудо-юдо читать полностью	no	58.21%	
все погодные эффекты дота 2	weather sirocco	no	74.67%	
топ кондиционеров для квартиры 2021	кондиционеры тошиба	yes	99.99%	
смотреть оно бесплатно	смотреть фильм форсаж 1	yes	99.99%	
Справки медосмотры самара	мориса тореза 103 рус клиника	yes	99.63%	
смерть любимого человека во сне	близкие люди попадали в аварию во сне к чему снится	yes	99.52%	
состав группы непара фамилии	в старину вечерей звался	no	99.99%	
Свое дело темы	пряники купить	no	99.99%	
к пришла в банк для того чтобы получить кредит в размере 100 000 рублей при этом она представила поддельные документы	правонарушение это	no	99.99%	
турция отель хорус парадиз люксори 5 звезд	cesars resort 5 турция сиде отзывы 2021 год	yes	99.67%	
перфект ворлд вход в личный кабинет официальный сайт	перфект ворлд книга наставлений	yes	99.99%	
док станция леново для ideapad	Lenovo 4X90V55523	yes	89.90%	
прочитай слова	читаем презентация	no	99.61%	
как получить ограничения от занятий физической культурой	электронная регистратура новосибирск	no	99.97%	
программа передач на сегодня 1 канал	концерт александра розенбаума	no	99.99%	
эльба	кпп ип	no	98.08%	
на какой улице проживал шерлок холмс	какие строки принадлежат а с пушкину	no	50.29%	
мособлеирц личный кабинет	инн 7826156685	no	92.75%	
полное погружение аниме	беззаботная старшеклассница аниме	yes	98.18%	
скачать книгу девчуля для братвы бесплатно полную версию	девчуля для братвы про что	yes	98.18%	
семейные тайны эротика	обмен жони кино фильм эротика	yes	99.52%	
минимальная пенсия 2021	пересчет пенсии госуслуги	yes	96.08%	
volkswagen tiguan комплектации и цены	toyota rav4 комплектации и цены	yes	96.20%	
рецепт панкейков на кефире в домашних условиях	солнце сверкает на оконных стёклах и витринах и отражается в городских фонтанах запятые	no	94.72%	
металлолом цена новосибирск	контакты в электрощитах	no	99.82%	
охота и патроны	Патрон Главпатрон к.12/70 32 г GOLD	no	98.71%	
аккорды стеклянная\ня	аккорды солнце золотое лсп	yes	99.53%	
Старые женские хиты о любви русские	женские хиты 2000-х русские	yes	99.10%	
какие меры должны быть приняты если контейнер средней грузоподъемности	по каеому показптелю определяется степерь опасности веществ	no	99.99%	
