INPUT:text1	INPUT:text2	OUTPUT:result	CONFIDENCE:result	
площадь треугольника	площадь треугольника равностороннего	yes	100.00%	
статистика выявленных фактов незаконного производства наркотических средств за последние 10 лет	судебная статистика статистика выявленных фактов незаконного производства наркотических средств за последние 10 лет	yes	100.00%	
Древний Египет	древний египет факты	yes	100.00%	
можно ли в коломенском парке заходить в церкви	можно ли в коломенском парке заходить в церкви	yes	100.00%	
запрещённое порно	как убрать жир на грудных мышцах у мужчин	no	100.00%	
окрошка на кефире калории	окрошка на кефире	yes	100.00%	
https://www.ufanet.ru/ m3u8	аппендицит	no	99.99%	
xvideo	как скрыть друга в вк	no	100.00%	
падеж существительных таблица	падеж прилагательных таблица с вопросами и окончаниями	yes	100.00%	
популярная желтая книга про продажи	популярная желтая книга по маркетингу	yes	100.00%	
еженощное пробуждение с	что такое метаболизм	no	100.00%	
история образования улицы Мира в Крестцы Новгородской области	история образования улицы Мира в Крестцы Новгородской области	yes	100.00%	
курящая кура	как перестать смущаться и краснеть	no	100.00%	
цитаты про любовь	цитаты про жизнь	yes	100.00%	
Яндекс	как избавиться от гнид	no	100.00%	
эмоции какие бывают	неоднозначные эмоции это как называется	yes	100.00%	
краска алкидно-акриловая (ас) 115 акриловая	краска алкидно-акриловая (ас) 115 акриловая характеристика	yes	100.00%	
Почему завязывают ниточку на запястье	Почему завязывают ниточку на запястье на левой руке	yes	100.00%	
самсунг галакси а8+ 2018 обзор	как осознать свою цель	no	100.00%	
солнечный берег чувашия новый год	жирная кожа лица что делать	no	99.99%	
найти иголку в одежде что значит	как изменить жизнь к лучшему	no	100.00%	
yup перевод	ноут не видит проектор	no	100.00%	
электронный дневник	как поставить палатку	no	100.00%	
ту ту точка ру сапсан тверь санкт питербург	как полюбить свою работу	no	100.00%	
купить в орле обувь мегатоп	купить в орле обувь марко	yes	100.00%	
локомотивная 104 ульяновск	где заработать денег	no	100.00%	
песни про голубой цвет	песни про синий цвет	yes	100.00%	
коляски для новорожденных из швейцарии	коляски для новорожденных из швейцарии	yes	100.00%	
поликлиника 50 красносельского района самозапись к врачу через интернет в спб	поликлиника 50 красносельского района спб расписание	yes	100.00%	
чем полезна брюссельская капуста	что подарить парню	no	99.99%	
брокколи рецепты приготовления	создать гугл аккаунт	no	100.00%	
свадьба с ограниченным бюджетом	блюдо из цветной капусты	no	100.00%	
погода спб на неделю	погода геленджик на неделю	yes	100.00%	
рулонные шторы 200х200	жалюзи 200х200	yes	100.00%	
ребёнок в шесть лет не учит стихи	как выбрать орхидею	no	100.00%	
советск ленина 45	как завязывать галстук	no	99.99%	
гдз сборник задач по физике 7-9 класс пёрышкин	гдз сборник задач по физике 7-9 класс пёрышкин	yes	100.00%	
маньячелло концовка	маньячелло концовка	yes	100.00%	
минелла мартинцова прогноз	аккаунт гугл	no	100.00%	
купить люверсы №1	люверсы самые маленькие купить	yes	100.00%	
как сесть на шпогат	секс во время месячных	no	100.00%	
судного дня star trek fleet command 27 уровня	Корабли судного дн star trek fleet command	yes	100.00%	
погода в иркутске	как выбрать обои	no	100.00%	
монах кто	монах кто это	yes	100.00%	
эротика	приготовление шашлыка	no	100.00%	
4 школа саранск	7 школа саранск	yes	100.00%	
как выгодно купить как выгодно купить новый автомобиль в салоне в кредит в городе ижевск	как удалить мозоли на ногах в домашних условиях	no	100.00%	
чешется левый глаз к чему это	что такое сон	no	100.00%	
орёл мебель шара кухни	орёл мебель шара	yes	100.00%	
встраиваемая микроволновая печь	как поймать мышей в домашних условиях	no	100.00%	
калькулятор онлайн	масса гидроксида калия	no	97.93%	
галсан имя что означает	базар имя что означает	yes	74.10%	
баксет беби саше инструкция цена	баксет беби или максилак беби	yes	99.98%	
процессы жизнедеятельности одноклеточных организмов 11 класс таблица	процессы жизнедеятельности одноклеточных организмов кратко и понятно самое важное	yes	99.99%	
фон сиреневый пушистый	Картинки для детского сада	no	99.05%	
Шкатулка песня	The Greatest песня	yes	94.39%	
кошелев крутые ключи работа в самаре вакансии	вакансии мега ашан самара московское шоссе	yes	64.28%	
рахмани рахим перевод	аль фатиха перевод	yes	99.89%	
это кот авокадо копыт	да блин бешенство кошка кусается	no	99.75%	
главная башня нижегородского кремля	русские женщины некрасов	no	97.93%	
аптека вита	аптека вита москва вакансии	yes	96.74%	
ария тебе дадут знак	ария небо тебя найдет	yes	99.96%	
подать на алименты гражданина другой страны	работа первоуральск пекарня 2 ночная	no	91.54%	
Dr.Web Desktop Security Suite или Kaspersky	черный лебедь колония	no	99.99%	
легенда алушта официальный сайт	олива-арт утес официальный сайт	yes	83.68%	
чехол для samsung a01 core в мтс	alloy gasket	no	91.54%	
детские мастерские в приморском районе спб	мастерские по дереву в спб	yes	99.99%	
шеф возвращение	шеф возвращение 17 серия смотреть онлайн	yes	99.95%	
Scorpions  Wind Of Change	Scorpions -- Always Somewhere [	yes	99.90%	
шапки вязаные женские	шапки которые идут всем	yes	99.99%	
fonbet battery	battery отказ в доступе	yes	99.99%	
black pink jennie	georgina rodriguez anal	yes	98.87%	
на рисунке отражено изменение предложения шоколада на соответствующем рынке линия предложения s переместилась в новое положение s	виды налогов и сборов в рф федеральные налоги	yes	99.99%	
vs bob 2.0 fnf	Шапки для канала АТА	no	96.05%	
время в хабаровске	тесты на категорию по неврологии с ответами для врачей	no	99.99%	
приколы другу	спам атака прикольнуться над другом	yes	99.99%	
дарина ларионова вк якутск	екатерина сорокина вк якутск	yes	99.83%	
как выделить объект в фотошопе	инструмент волшебная палочка в фотошопе	yes	91.02%	
детралекс 1000 инструкция по применению цена отзывы аналоги	проктогливенол мазь инструкция по применению цена отзывы аналоги	yes	91.02%	
Это же корвет	оформить карту мир в сбербанке	no	98.12%	
дагомыс сухогруз судно	от чего зависит активное сопротивление	no	93.10%	
мой мир	премьер-лига-россии-2021-2022 по футболу	no	99.97%	
frosty mod manager скачать fifa 19	extreme injector fifa 19	yes	99.95%	
днс купить смартфон редми 9 с в днс цена в москве	телефон leagoo m9 pro характеристики и цена	yes	79.19%	
депутаты березниковской городской думы действующие список	новости пермь	no	99.84%	
программа голос агутин и наргиз	голос агутин	yes	98.99%	
используя рисунок 2 запишите формулы веществ и рассчитайте их относительные молекулярные массы	каковы основные значения понятия природа	no	91.34%	
архитектура стали отзывы	русский забор строительный пр 7а отзывы	yes	98.20%	
где сдать тест на коронавирус Спб	Где сдать экспресс тест на ковид СПб	yes	99.99%	
яндекс диск	телефоны с самой лучшей камерой	no	88.53%	
в пруду плавали утки 4 класс	согласишься ли ты с пословицей дружба заботой да подмогой крепка	yes	92.19%	
манга сегодня злодейка счастлива	манга я стала богатой аристократкой	yes	99.83%	
доклад про одну бактерию 5 класс по биологии	сообщение про кокки 7 класс	yes	65.64%	
сергач авито	сергач подслушано	yes	99.94%	
николай заварзин ПСРЗ находка	жена депутата из Находки умерла от липосакции	no	67.48%	
объясните употребления простого настоящего времени\	it does take me long	no	86.51%	
расценки в домодедово всех работ по отделки внутренних работ в квартирах поклейка обоев,шпаклевка и т.д?	сколько стоит работа сделать цоколь под дикий камень?	yes	94.16%	
Программа передач	гранд новые серии 2021 смотреть бесплатно в хорошем качестве	yes	78.82%	
ответ по математике 4 класс учебник	ОТВЕТ ПО РУССКОМУ ЯЗЫКУ 4 КЛАСС УЧЕБНИК КАНАКИНА 1 ЧАСТЬ	yes	99.49%	
осб 9 мм цена за лист график цен	стройлето стройматериалы клин	no	95.90%	
симптомы беременности	через сколько после беременности растет грудь	yes	99.80%	
sexy kız  sevgilisine soyunuyor	petek dinçöz hot	yes	99.88%	
похожие аниме на мастера меча онлайн	беглец мелодрама	no	83.30%	
мок и мод	структура олимпийского комитета	no	57.59%	
почему горят суставы на одной стороне тела	почему не стоит гуглить симптомы в интернете	yes	99.98%	
сказка заяц хвастун	гумно это	no	99.99%	
фильтр топлива рено 1.5 dci купить	рено модус замена ремня генератора дизель	yes	99.98%	
отделка бани комната отдыха внутри фото	настурция фото на клумбе	no	99.90%	
распространяются ли обязанности по хранению информации об электронных сообщениях	коммуникационный интернет-сервис	yes	89.80%	
лиза лида	обилие mr lambo скачать	no	99.86%	
купить телефон ООО ривьера	купить iphone	yes	82.51%	
Вспомогательные вещества в суспензиях для инъекций	пропиленгликоль пролонгатор	yes	99.60%	
музыка без слов с днем рождения	хэппи бездей музыка	yes	98.84%	
Время покажет 17.09.21	время покажет последний выпуск сегодня	yes	99.83%	
ТАБЛЕТНИЦА ПИЛЮЛЯ АРТ.74100 НА 1 ДЕНЬ Д/ЛЕК СРЕДСТВ (АЛЬПИНА ПЛАСТ О)	чуз ржд-медицина краснодар	no	99.89%	
Рустам хуснутдинов агрыз 1981	Слушать песню прости меня за все	no	99.99%	
тумбы под тв узкие глубиной 25 см	сколько времени ставится на кадастровый учет новостройка	no	99.96%	
роспотребнадзор новосибирск официальный сайт новосибирск жалоба	мастер по ремонту взял деньги и пропал	no	99.99%	
как сменить язык в футбол менеджер 2020	почему пес не запускается	no	99.42%	
смотреть канал доверие	содержание предмета история 11 класс фгос торкунов	no	99.95%	
установка на осень	установка на осень на 1 сентября	yes	99.78%	
проверочная работа по английскому 7 класс 1 модуль	school4krpr.eljur.ru hello	yes	97.74%	
сипр для слепых детей	фгос до для детей с овз	yes	92.02%	
можно ли оформить соц контракт на обучение в автошколе 2021	оирц вк обсуждения	no	89.27%	
кронштейн шарнирный универсальный для извещателей bracket tantos цена	оповещатель охранно-пожарный комбинированный УСС-М-12 цена	no	63.05%	
Не люби его	Песня ты полюбила дебила	yes	99.84%	
Кто обязан информировать работников об полагающихся им СИЗ?	Срок проведения специальной оценки условий труда	yes	81.24%	
Мужские славянские имена	имя для ребенка рожденного в марте	yes	99.38%	
аптека ру	триампур таблетки	yes	92.02%	
ноотропы с доказанной эффективностью список	атаракс после инсульта как принимать	no	53.49%	
инн организации	инн организации ООО РУсская поварня	yes	99.99%	
норма амортизационных отчислений	начислить амортизационные отчисления за каждый месяц	yes	98.81%	
Grohe Grohtherm 800 34576000	grohe essence 33624002	yes	98.54%	
административный округ москвы на щукинской	участок 3132	yes	55.65%	
Ампула льва толстого	прапорщик в солдатах сканворд	no	100.00%	
Болид Центральный сервер Орион Про	bas ip	no	99.99%	
чистка фильтра на веко	авито вольск	no	99.89%	
01714960650 Wurth Настенная раздаточная система для бумаги	102-40113 Комплект крышек адаптеров 13 предметов МАСТАК – 1шт	yes	98.75%	
док татар.ру	арбитражный суд рт официальный сайт	no	99.99%	
Он доехал быстрее (1) чем я думал (2) потому что (3) когда я спустился во двор (4) и (5) подошёл к условленному месту (6) на скамейке под липой уже маячила тёмная фигура.	Он заявил (1) что желает переговорить с ней (2) и (3) когда получил уклончивый, даже дерзкий ответ (4) что она не хочет с ним говорить (5) то ему пришла в голову давно задуманная мысль (6) о которой он заявлял .	yes	95.42%	
Партия титова	как засунуть сшитый полиэтилен в канализационную трубу	no	100.00%	
Дот спивак	джим парсонс	yes	93.94%	
борис стукалов	стукалов алексей тренер по футболу	yes	93.03%	
майл ру	гисметео краснодар	no	99.99%	
металл профиль тюмень	полуавтомат ресанта саипа 165	no	99.99%	
значение фразеологизма между небом и землей	правописание истинный	no	70.20%	
обрядовая смола 5 букв на л начинается	зачет по гто 8	no	97.16%	
леруа мерлен липецк строительство	леруа мерлен липецк каталог	yes	99.60%	
гдз по биологии 9 класс пономарева	сформулируйте правильный ответ какой относится биология 9 класс Пономарева	yes	99.87%	
2. Иванов при следовании к месту работы за 10 минут до начала смены на территории организации поскользнулся и упал, получив травму. Комиссия организации сочла этот случай не связанным с производством с учетом того, что Иванов к работе еще не приступил. Страховой стаж Иванова три года;	255 фз	no	99.99%	
лидия шпангенбергер (к	оксана сальных таганрог	no	99.99%	
Напишите программу, которая вводит два целых числа, a и b ( a < b ), и выводит через пробел 5 случайных целых чисел на отрезке [ a , b ] .	строка рандома в питоне	yes	99.79%	
снять студию авито чебоксары	форум на связи жилье чебоксары	yes	99.99%	
сохранить группу в ifc	ГОСТ 21.501-2011	no	97.71%	
синхронизатор хендай акцент	хендай акцент 2007 опорный подшипник артикул задний	yes	99.56%	
чувашия чебоксары	губернатор нижнего новгорода нижегородской области	no	91.34%	
Мощность линейного трансформатора определяется	Напряжение вторичной обмотки трансформатора ОМ линий ВЛ СЦБ	yes	99.95%	
JASMINE PALACE RESORT & SPA 5*	BRAYKA BAY RESORT 5*	yes	97.58%	
сиротка жившая с кокованей 6 букв сканворд	проток в дельте реки 5 букв на г	no	92.71%	
в койку анекдот	анекдот а поцеловать корова	yes	87.19%	
пирог с вареньем	катя березняцкая инстаграмм гродно	no	99.99%	
в связи с	профессия ресторатор	no	99.99%	
смолевичи - сула расстояние	Смолевичи Дзержинск расстояние	yes	89.94%	
Русская изба убранство русской избы рисунки	гдз по английскому языку 5 класс сборник упражнений в фокусе	no	99.99%	
Мила Сивацкая	актеры из сериала гранд	yes	99.74%	
наговицын песня звездочка	кучин песни мостик деревянный	yes	99.74%	
выборгский замок	музей на невском пятачке прорыв блокады	yes	87.23%	
Green Paradise Beach 4	fun sun family club saphire 5	yes	99.97%	
остров разлуки	судьба седой капитан	no	67.37%	
растекаться мыслею по древу	Он вещие персты свои на живые струны вскладывал,	yes	96.70%	
пятнадцать человек на сундук мертвеца песня	гротеск песни из острова сокровищ	yes	99.99%	
что бормочешь ты полночь наша	пролей со мной поток о мельпомена слезный восплачь и возрыдай и растрепли власы	yes	98.02%	
posso глагол	столица пьемонта	no	89.56%	
фильм про мужчиНу с маленьким членом германия	размер имеет значение	no	85.71%	
каким знаком обозначается разница в математике	образец коммерческого предложения	no	99.12%	
Павел перелыгин	павел перелыгин москва фото	yes	99.92%	
модерн токинг ёмахо емасо скачать бесплатно	песня за	no	95.97%	
4 на 5 в пикселях	как изменить размер фотографии	yes	99.99%	
Каким странам принадлежало первенство в географических открытиях конца XV — начала XVI в.?	Какой материк был назван именем итальянского путешественника Америго Веспуччи?	yes	99.97%	
как установить на круглую фундамент опалубку	доска для опалубки бу таганрог	yes	99.99%	
int в str с нуля python pandas	int в str четырёхзначный	yes	99.78%	
кунсткамера санкт-петербург	дом пашкова в москве	yes	97.00%	
предмет административного права	Предмет тгп	yes	98.61%	
гдз по географии 9 класс ответы на вопросы в учебнике дронов савельева	какую часть населения считают трудовыми ресурсами с чем связано их сокращение география	no	56.86%	
eryaman kız öğrenci yurdu	sincan yükseköğretim	yes	92.46%	
x3+6x2y+11xy2+6y3 0	onenote плагины	no	99.67%	
собачье сердце доктор преображенский анализ	как перезагрузить ноутбук с помощью клавиатуры	no	99.97%	
паустовский константин	Касатонов Игорь биография адмирал	no	91.15%	
английский язык 7 английский язык 7 класс афанасьева английский язык 7 класс английский язык 7 класс афанасьева михеева	можно ли есть хлеб при похудении вечером при похудении на ночь отзывы	no	83.71%	
TITANIC BEACH SPA & AQUA ... 5*	LE PACHA RESORT 4*	yes	98.03%	
Проблемы внедрения IoT?	Будущее интернета вещей	no	94.56%	
